<?xml version="1.0"  standalone="no"?>
<!DOCTYPE novedades SYSTEM "novedades.dtd">

<novedades>
    <fecha>Octubre 2000</fecha>
    <disco genero="pop">
        <titulo>O sea</titulo>
        <interprete>Enrique Iglesias</interprete>
    </disco>
    <libro>
        <titulo>Aplicaciones web</titulo>
        <autor>John McCarra</autor>
        <autor>Frank Webini</autor>
    </libro>

</novedades>